{
  "schema_version": "1.0",
  "scanner_id": "sentinel-scan-cli",
  "display_name": "sentinel-scan-cli (Ventrova)",
  "scanner_versions": ["1.4.16"],
  "adapter_version": "1.0.0",
  "label_provenance": "captured-from-real-output",
  "provenance_note": "Seven labels -- tool_definition_drift, tool_description_injection, excessive_agency_schema, indirect_injection_surface, missing_hitl_confirmation, unpinned_remote_source, missing_provenance -- were copied verbatim from output this project produced and committed at tests/fixtures/sentinel-scan-cli-a02-post-trigger-report.json and tests/fixtures/sentinel-scan-cli-whole-corpus-report.json (image mcp-sec-bench/sentinel-scan-cli:1.4.16, corpus v1-0ef4bd851ab8). The remaining eight were read out of the shipped module in that same pinned image (`python -c \"import re,sentinel_scan; print(sorted(set(re.findall(r'_mcp_finding\\(\\s*\\n?\\s*\\\"([a-z_]+)\\\"', open(sentinel_scan.__file__).read()))))\"`), which is the code that emits the string rather than vendor prose about it -- so the SPELLING of every label here is verified against the shipped build. Labels not yet seen to fire on this corpus carry status `provisional`, which is what separates a verified spelling from a verified behaviour. NOTE FOR REVIEWERS: docs/scanner-survey.md lists 11 heuristics for this tool; 1.4.16 actually emits 15. The four the survey does not name are command_injection_risk, cross_origin_exfiltration, dos_resource_exhaustion and homoglyph_typosquat, and all four are covered below so that none of them could arrive as an unrecognised label mid-run.",
  "label_source_field": "results[].heuristic",
  "frozen_for_corpus_version": "v1-0ef4bd851ab8",
  "matching": {
    "case_insensitive": false,
    "strip_surrounding_whitespace": false,
    "note": "Byte-exact, the default. sentinel-scan-cli's heuristic ids are literal string arguments to a single finding constructor (_mcp_finding) in one module, so they cannot drift in case or spacing within a build; nothing here justifies loosening the match."
  },
  "notes": [
    "Covers all 15 heuristic ids emitted by sentinel-scan-cli 1.4.16. Six map, nine are unmapped with a stated reason. Per docs/scoring.md an unmapped finding is neither a true nor a false positive, so the nine cost this scanner nothing; they are a claim about the reach of OUR taxonomy, not about the tool.",
    "READ THIS BEFORE READING THE ROW. This scanner takes an mcp.json manifest and nothing else: it cannot read a source tree and cannot connect to an endpoint. The corpus ships no mcp.json, so runner/adapters/sentinel_scan.py GENERATES one per server -- the tool descriptors verbatim as tools/list served them, plus an mcpServers block describing the live lab endpoint. Two consequences change how the raw output should be read, and neither is a mapping decision: (1) unpinned_remote_source and missing_provenance fire on all 15 servers (30 of 42 findings) and are properties of the generated config file and the lab's plain-HTTP deployment, not of any corpus server's source; (2) hardcoded_credential cannot fire at all, because the adapter writes the lab bearer token as a ${MCPBENCH_TOKEN} placeholder rather than a literal -- planting the literal would have manufactured A7 true positives against a credential we put in a file we wrote.",
    "tool_definition_drift is the entry that matters most on this board: A2 (rug-pull) is detected by no other scanner here, and this label is the only purpose-built rug-pull check among them. It only exists when the scanner is given --baseline AND two captures of the same tool. That is off by default and a single-shot invocation can never produce it; the adapter drives the sequence explicitly (capture 1 -> --update-baseline -> provoke -> capture N -> --baseline). That is an invocation fact, not a mapping fact, but a reader comparing this row to another scanner's 0.00 on A2 should know the harness had to work for it. Verified firing on a02-rug-pull.",
    "One false positive on this corpus is caused by the harness rather than by the scanner's judgment, and it is left in place deliberately. Driving a02's rug-pull means the post-trigger manifest contains the injected descriptor, so tool_description_injection fires on summarize_changelog as well; that label maps to A1, a02 declares A2 and tolerates nothing, so the finding scores as a false positive and a near miss (right server, wrong class). Suppressing it would mean keying a mapping on the server and its state, which docs/mapping-rationale.md R5 forbids; R6 prefers the error a reader can see on a named item. It is the same phenomenon A2 credits, reported under an A1-shaped label.",
    "excessive_agency_schema is the entry most likely to be argued with, because it is the label that fired on a10b-allowlist-bypass's run_build with the evidence text 'parameter \"command\" is a free-form string with no enum/pattern - looks like arbitrary command/code execution'. It is left UNMAPPED under R4. The reason is structural: one label covers five different schema shapes, and two of them satisfy two different classes' tests (the free-form command parameter points at A10, the unconstrained path parameter points at A8). docs/mapping-rationale.md section 2 forbids keying a decision on the finding's free-text message, so there is no permitted way to split them, and R4 says the label is not mapped to the least-bad option. Declining costs this scanner a plausible detection on a10b; forcing it would cost the benchmark its claim to be measuring the tool rather than our reading of one evidence string.",
    "Four of our ten classes have no sentinel-scan-cli label whose present-when test they satisfy, so a miss there is a false negative rather than a mapping gap: A4 (response injection), A5 (argument exfiltration), A6 (authless endpoint), A8 (unrestricted file read). All four need either a tool's return value, an observed egress attempt, an auth posture, or source-level containment analysis, and none of those is visible in a tool manifest.",
    "Read docs/mapping-rationale.md for the R1-R6 decision procedure the rationale text cites."
  ],
  "entries": [
    {
      "raw_label": "tool_definition_drift",
      "label_note": "Vendor's own docstring: 'MCP04: a tool's current definition hash no longer matches a previously recorded baseline for that tool name - the \"MCP rug pull\" pattern ... where a server changes a tool's description/schema after it was already reviewed and trusted, so a static single-scan check can't catch it but a baseline comparison across scans can.' The hash covers exactly (name, description, inputSchema). Emitted only when --baseline names a file written by a prior --update-baseline run.",
      "applies_to_stage": "any",
      "decision": "map",
      "mapped_class": "A2",
      "taxonomy_evidence": {
        "present_when_quote": "the descriptor served for a given tool differs between two points in the server's lifecycle, and the later version contains content that would independently qualify under A1, or advertises a capability the earlier version did not. A cosmetic diff (version string, whitespace, a reworded sentence with no behavioural content) does not qualify",
        "why_satisfied": "The rule compares the sha256 of (name, description, inputSchema) for one tool against the hash recorded for that same tool name at an earlier point, and fires when they differ. That is the first clause of the test exactly: the descriptor served for a given tool differs between two points in the running instance's lifecycle. The second clause -- that the later version independently qualifies under A1 or advertises new capability -- is a judgment the corpus author makes and records in the manifest (a02's manifest records both descriptors and the trigger index); it is ground truth for the scorer to apply, not a property any label can assert, in the same way A7's 'the manifest marks a literal as a planted secret' is not something a secret-scanning rule can satisfy."
      },
      "considered_classes": [
        {
          "class": "A1",
          "why_rejected": "A1's Not-this-class clause settles it in one line: 'the payload is present from the first tools/list. If it only appears after a state change, it is A2.' This label reports the state change itself and asserts nothing whatsoever about the text of either descriptor -- it is a hash comparison. Mapping it to A1 would credit a detection of a payload for a rule that never reads one."
        },
        {
          "class": "A3",
          "why_rejected": "A3 requires a descriptor field that references a tool or server other than itself. This rule compares one tool against its own earlier hash and has no cross-server notion at all; sentinel-scan-cli registers tool_name_shadowing separately for the cross-tool case."
        }
      ],
      "resolution_rules": ["R1", "R2"],
      "rationale_id": "MR-sentinel-scan-cli-001",